{
  "id": "lopezot01_2025",
  "name": "Otto Lopez",
  "team": "Miami Marlins",
  "season": 2025,
  "league": "MLB",
  "verified": false,
  "source": {
    "provider": "Lahman Baseball Database (SABR)",
    "url": "https://sabr.org/lahman-database/",
    "retrieved_at": "2026-10-14",
    "note": "Lahman Baseball Database から機械的に生成（同じシーズンに複数の球団に在籍した選手は成績を合算し、PA は AB+BB+HBP+SF+SH で算出）。独立した第二出典との照合は未実施。使用した版：Release Date: Dec 10, 2025。"
  },
  "team_info": {
    "code": "MIA",
    "name": "Miami Marlins",
    "league": "NL"
  },
  "stats": {
    "PA": 594,
    "AB": 544,
    "H": 134,
    "2B": 21,
    "3B": 0,
    "HR": 15,
    "BB": 44,
    "HBP": 3,
    "SO": 82,
    "SF": 3,
    "SH": 0,
    "GIDP": 9,
    "SB": 15,
    "CS": 6
  }
}
