{
  "id": "abramcj01_2025",
  "name": "CJ Abrams",
  "team": "Washington Nationals",
  "season": 2025,
  "league": "MLB",
  "verified": false,
  "source": {
    "provider": "Lahman Baseball Database (SABR)",
    "url": "https://sabr.org/lahman-database/",
    "retrieved_at": "2026-10-14",
    "note": "Lahman Baseball Database から機械的に生成（同じシーズンに複数の球団に在籍した選手は成績を合算し、PA は AB+BB+HBP+SF+SH で算出）。独立した第二出典との照合は未実施。使用した版：Release Date: Dec 10, 2025。"
  },
  "team_info": {
    "code": "WSH",
    "name": "Washington Nationals",
    "league": "NL",
    "lahman_id": "WAS"
  },
  "stats": {
    "PA": 635,
    "AB": 580,
    "H": 149,
    "2B": 35,
    "3B": 5,
    "HR": 19,
    "BB": 37,
    "HBP": 14,
    "SO": 125,
    "SF": 3,
    "SH": 1,
    "GIDP": 5,
    "SB": 31,
    "CS": 3
  }
}
