{
  "id": "clemeer01_2025",
  "name": "Ernie Clement",
  "team": "Toronto Blue Jays",
  "season": 2025,
  "league": "MLB",
  "verified": false,
  "source": {
    "provider": "Lahman Baseball Database (SABR)",
    "url": "https://sabr.org/lahman-database/",
    "retrieved_at": "2026-10-14",
    "note": "Lahman Baseball Database から機械的に生成（同じシーズンに複数の球団に在籍した選手は成績を合算し、PA は AB+BB+HBP+SF+SH で算出）。独立した第二出典との照合は未実施。使用した版：Release Date: Dec 10, 2025。"
  },
  "team_info": {
    "code": "TOR",
    "name": "Toronto Blue Jays",
    "league": "AL",
    "lahman_id": "TOR"
  },
  "stats": {
    "PA": 588,
    "AB": 545,
    "H": 151,
    "2B": 35,
    "3B": 2,
    "HR": 9,
    "BB": 27,
    "HBP": 4,
    "SO": 61,
    "SF": 5,
    "SH": 7,
    "GIDP": 13,
    "SB": 6,
    "CS": 5
  }
}
