{
  "id": "mcneije01_2025",
  "name": "Jeff McNeil",
  "team": "New York Mets",
  "season": 2025,
  "league": "MLB",
  "verified": false,
  "source": {
    "provider": "Lahman Baseball Database (SABR)",
    "url": "https://sabr.org/lahman-database/",
    "retrieved_at": "2026-10-14",
    "note": "Lahman Baseball Database から機械的に生成（同じシーズンに複数の球団に在籍した選手は成績を合算し、PA は AB+BB+HBP+SF+SH で算出）。独立した第二出典との照合は未実施。使用した版：Release Date: Dec 10, 2025。"
  },
  "team_info": {
    "code": "NYM",
    "name": "New York Mets",
    "league": "NL",
    "lahman_id": "NYN"
  },
  "stats": {
    "PA": 462,
    "AB": 399,
    "H": 97,
    "2B": 21,
    "3B": 5,
    "HR": 12,
    "BB": 49,
    "HBP": 8,
    "SO": 55,
    "SF": 4,
    "SH": 2,
    "GIDP": 5,
    "SB": 3,
    "CS": 0
  }
}
