{
  "id": "schwaky01_2025",
  "name": "Kyle Schwarber",
  "team": "Philadelphia Phillies",
  "season": 2025,
  "league": "MLB",
  "verified": false,
  "source": {
    "provider": "Lahman Baseball Database (SABR)",
    "url": "https://sabr.org/lahman-database/",
    "retrieved_at": "2026-10-14",
    "note": "Lahman Baseball Database から機械的に生成（同じシーズンに複数の球団に在籍した選手は成績を合算し、PA は AB+BB+HBP+SF+SH で算出）。独立した第二出典との照合は未実施。使用した版：Release Date: Dec 10, 2025。"
  },
  "team_info": {
    "code": "PHI",
    "name": "Philadelphia Phillies",
    "league": "NL"
  },
  "stats": {
    "PA": 724,
    "AB": 604,
    "H": 145,
    "2B": 23,
    "3B": 2,
    "HR": 56,
    "BB": 108,
    "HBP": 11,
    "SO": 197,
    "SF": 1,
    "SH": 0,
    "GIDP": 4,
    "SB": 10,
    "CS": 2
  }
}
