{
  "id": "moniami01_2025",
  "name": "Mickey Moniak",
  "team": "Colorado Rockies",
  "season": 2025,
  "league": "MLB",
  "verified": false,
  "source": {
    "provider": "Lahman Baseball Database (SABR)",
    "url": "https://sabr.org/lahman-database/",
    "retrieved_at": "2026-10-14",
    "note": "Lahman Baseball Database から機械的に生成（同じシーズンに複数の球団に在籍した選手は成績を合算し、PA は AB+BB+HBP+SF+SH で算出）。独立した第二出典との照合は未実施。使用した版：Release Date: Dec 10, 2025。"
  },
  "team_info": {
    "code": "COL",
    "name": "Colorado Rockies",
    "league": "NL"
  },
  "stats": {
    "PA": 461,
    "AB": 434,
    "H": 117,
    "2B": 20,
    "3B": 8,
    "HR": 24,
    "BB": 22,
    "HBP": 2,
    "SO": 110,
    "SF": 3,
    "SH": 0,
    "GIDP": 4,
    "SB": 9,
    "CS": 3
  }
}
