{
  "id": "vargami01_2025",
  "name": "Miguel Vargas",
  "team": "Chicago White Sox",
  "season": 2025,
  "league": "MLB",
  "verified": false,
  "source": {
    "provider": "Lahman Baseball Database (SABR)",
    "url": "https://sabr.org/lahman-database/",
    "retrieved_at": "2026-10-14",
    "note": "Lahman Baseball Database から機械的に生成（同じシーズンに複数の球団に在籍した選手は成績を合算し、PA は AB+BB+HBP+SF+SH で算出）。独立した第二出典との照合は未実施。使用した版：Release Date: Dec 10, 2025。"
  },
  "team_info": {
    "code": "CWS",
    "name": "Chicago White Sox",
    "league": "AL",
    "lahman_id": "CHA"
  },
  "stats": {
    "PA": 569,
    "AB": 504,
    "H": 118,
    "2B": 32,
    "3B": 2,
    "HR": 16,
    "BB": 56,
    "HBP": 6,
    "SO": 100,
    "SF": 3,
    "SH": 0,
    "GIDP": 9,
    "SB": 6,
    "CS": 0
  }
}
