{
  "id": "smithca07_2025",
  "name": "Cam Smith",
  "team": "Houston Astros",
  "season": 2025,
  "league": "MLB",
  "verified": false,
  "source": {
    "provider": "Lahman Baseball Database (SABR)",
    "url": "https://sabr.org/lahman-database/",
    "retrieved_at": "2026-10-14",
    "note": "Lahman Baseball Database から機械的に生成（同じシーズンに複数の球団に在籍した選手は成績を合算し、PA は AB+BB+HBP+SF+SH で算出）。独立した第二出典との照合は未実施。使用した版：Release Date: Dec 10, 2025。"
  },
  "team_info": {
    "code": "HOU",
    "name": "Houston Astros",
    "league": "AL"
  },
  "stats": {
    "PA": 493,
    "AB": 441,
    "H": 104,
    "2B": 21,
    "3B": 3,
    "HR": 9,
    "BB": 43,
    "HBP": 7,
    "SO": 137,
    "SF": 2,
    "SH": 0,
    "GIDP": 11,
    "SB": 8,
    "CS": 1
  }
}
