{
  "id": "wallsta01_2025",
  "name": "Taylor Walls",
  "team": "Tampa Bay Rays",
  "season": 2025,
  "league": "MLB",
  "verified": false,
  "source": {
    "provider": "Lahman Baseball Database (SABR)",
    "url": "https://sabr.org/lahman-database/",
    "retrieved_at": "2026-10-14",
    "note": "Lahman Baseball Database から機械的に生成（同じシーズンに複数の球団に在籍した選手は成績を合算し、PA は AB+BB+HBP+SF+SH で算出）。独立した第二出典との照合は未実施。使用した版：Release Date: Dec 10, 2025。"
  },
  "team_info": {
    "code": "TBA",
    "name": "Tampa Bay Rays",
    "league": "AL"
  },
  "stats": {
    "PA": 317,
    "AB": 282,
    "H": 62,
    "2B": 14,
    "3B": 1,
    "HR": 4,
    "BB": 26,
    "HBP": 0,
    "SO": 70,
    "SF": 6,
    "SH": 3,
    "GIDP": 1,
    "SB": 14,
    "CS": 6
  }
}
