{
  "id": "suareeu01_2025",
  "name": "Eugenio Suarez",
  "team": "Seattle Mariners",
  "season": 2025,
  "league": "MLB",
  "verified": false,
  "source": {
    "provider": "Lahman Baseball Database (SABR)",
    "url": "https://sabr.org/lahman-database/",
    "retrieved_at": "2026-10-14",
    "note": "Lahman Baseball Database から機械的に生成（同じシーズンに複数の球団に在籍した選手は成績を合算し、PA は AB+BB+HBP+SF+SH で算出）。独立した第二出典との照合は未実施。使用した版：Release Date: Dec 10, 2025。"
  },
  "team_info": {
    "code": "SEA",
    "name": "Seattle Mariners",
    "league": "AL",
    "lahman_id": "SEA"
  },
  "teams_played": [
    {
      "code": "AZ",
      "name": "Arizona Diamondbacks"
    },
    {
      "code": "SEA",
      "name": "Seattle Mariners"
    }
  ],
  "stats": {
    "PA": 657,
    "AB": 588,
    "H": 134,
    "2B": 28,
    "3B": 0,
    "HR": 49,
    "BB": 46,
    "HBP": 16,
    "SO": 196,
    "SF": 7,
    "SH": 0,
    "GIDP": 11,
    "SB": 4,
    "CS": 1
  }
}
