{
  "id": "troutmi01_2025",
  "name": "Mike Trout",
  "team": "Los Angeles Angels of Anaheim",
  "season": 2025,
  "league": "MLB",
  "verified": false,
  "source": {
    "provider": "Lahman Baseball Database (SABR)",
    "url": "https://sabr.org/lahman-database/",
    "retrieved_at": "2026-10-14",
    "note": "Lahman Baseball Database から機械的に生成（同じシーズンに複数の球団に在籍した選手は成績を合算し、PA は AB+BB+HBP+SF+SH で算出）。独立した第二出典との照合は未実施。使用した版：Release Date: Dec 10, 2025。"
  },
  "team_info": {
    "code": "LAA",
    "name": "Los Angeles Angels of Anaheim",
    "league": "AL"
  },
  "stats": {
    "PA": 555,
    "AB": 456,
    "H": 106,
    "2B": 14,
    "3B": 1,
    "HR": 26,
    "BB": 87,
    "HBP": 6,
    "SO": 178,
    "SF": 6,
    "SH": 0,
    "GIDP": 7,
    "SB": 2,
    "CS": 0
  }
}
