{
  "id": "durbica01_2025",
  "name": "Caleb Durbin",
  "team": "Milwaukee Brewers",
  "season": 2025,
  "league": "MLB",
  "verified": false,
  "source": {
    "provider": "Lahman Baseball Database (SABR)",
    "url": "https://sabr.org/lahman-database/",
    "retrieved_at": "2026-10-14",
    "note": "Lahman Baseball Database から機械的に生成（同じシーズンに複数の球団に在籍した選手は成績を合算し、PA は AB+BB+HBP+SF+SH で算出）。独立した第二出典との照合は未実施。使用した版：Release Date: Dec 10, 2025。"
  },
  "team_info": {
    "code": "MIL",
    "name": "Milwaukee Brewers",
    "league": "NL",
    "lahman_id": "MIL"
  },
  "stats": {
    "PA": 506,
    "AB": 445,
    "H": 114,
    "2B": 25,
    "3B": 0,
    "HR": 11,
    "BB": 30,
    "HBP": 24,
    "SO": 50,
    "SF": 4,
    "SH": 3,
    "GIDP": 10,
    "SB": 18,
    "CS": 6
  }
}
