{
  "id": "kurtzni01_2025",
  "name": "Nick Kurtz",
  "team": "Athletics",
  "season": 2025,
  "league": "MLB",
  "verified": false,
  "source": {
    "provider": "Lahman Baseball Database (SABR)",
    "url": "https://sabr.org/lahman-database/",
    "retrieved_at": "2026-10-14",
    "note": "Lahman Baseball Database から機械的に生成（同じシーズンに複数の球団に在籍した選手は成績を合算し、PA は AB+BB+HBP+SF+SH で算出）。独立した第二出典との照合は未実施。使用した版：Release Date: Dec 10, 2025。"
  },
  "team_info": {
    "code": "ATH",
    "name": "Athletics",
    "league": "AL",
    "lahman_id": "ATH"
  },
  "stats": {
    "PA": 488,
    "AB": 420,
    "H": 122,
    "2B": 26,
    "3B": 2,
    "HR": 36,
    "BB": 63,
    "HBP": 2,
    "SO": 151,
    "SF": 3,
    "SH": 0,
    "GIDP": 4,
    "SB": 2,
    "CS": 1
  }
}
