{
  "id": "canaral01_2025",
  "name": "Alexander Canario",
  "team": "Pittsburgh Pirates",
  "season": 2025,
  "league": "MLB",
  "verified": false,
  "source": {
    "provider": "Lahman Baseball Database (SABR)",
    "url": "https://sabr.org/lahman-database/",
    "retrieved_at": "2026-10-14",
    "note": "Lahman Baseball Database から機械的に生成（同じシーズンに複数の球団に在籍した選手は成績を合算し、PA は AB+BB+HBP+SF+SH で算出）。独立した第二出典との照合は未実施。使用した版：Release Date: Dec 10, 2025。"
  },
  "team_info": {
    "code": "PIT",
    "name": "Pittsburgh Pirates",
    "league": "NL"
  },
  "stats": {
    "PA": 234,
    "AB": 216,
    "H": 47,
    "2B": 6,
    "3B": 1,
    "HR": 6,
    "BB": 17,
    "HBP": 0,
    "SO": 80,
    "SF": 1,
    "SH": 0,
    "GIDP": 5,
    "SB": 3,
    "CS": 1
  }
}
