{
  "id": "gormano01_2025",
  "name": "Nolan Gorman",
  "team": "St. Louis Cardinals",
  "season": 2025,
  "league": "MLB",
  "verified": false,
  "source": {
    "provider": "Lahman Baseball Database (SABR)",
    "url": "https://sabr.org/lahman-database/",
    "retrieved_at": "2026-10-14",
    "note": "Lahman Baseball Database から機械的に生成（同じシーズンに複数の球団に在籍した選手は成績を合算し、PA は AB+BB+HBP+SF+SH で算出）。独立した第二出典との照合は未実施。使用した版：Release Date: Dec 10, 2025。"
  },
  "team_info": {
    "code": "STL",
    "name": "St. Louis Cardinals",
    "league": "NL",
    "lahman_id": "SLN"
  },
  "stats": {
    "PA": 402,
    "AB": 351,
    "H": 72,
    "2B": 14,
    "3B": 1,
    "HR": 14,
    "BB": 47,
    "HBP": 0,
    "SO": 136,
    "SF": 4,
    "SH": 0,
    "GIDP": 1,
    "SB": 1,
    "CS": 1
  }
}
