{
  "id": "carlsdy01_2025",
  "name": "Dylan Carlson",
  "team": "Baltimore Orioles",
  "season": 2025,
  "league": "MLB",
  "verified": false,
  "source": {
    "provider": "Lahman Baseball Database (SABR)",
    "url": "https://sabr.org/lahman-database/",
    "retrieved_at": "2026-10-14",
    "note": "Lahman Baseball Database から機械的に生成（同じシーズンに複数の球団に在籍した選手は成績を合算し、PA は AB+BB+HBP+SF+SH で算出）。独立した第二出典との照合は未実施。使用した版：Release Date: Dec 10, 2025。"
  },
  "team_info": {
    "code": "BAL",
    "name": "Baltimore Orioles",
    "league": "AL",
    "lahman_id": "BAL"
  },
  "stats": {
    "PA": 241,
    "AB": 217,
    "H": 44,
    "2B": 9,
    "3B": 1,
    "HR": 6,
    "BB": 21,
    "HBP": 2,
    "SO": 54,
    "SF": 1,
    "SH": 0,
    "GIDP": 3,
    "SB": 3,
    "CS": 3
  }
}
