{
  "id": "iglesjo01_2025",
  "name": "Jose Iglesias",
  "team": "San Diego Padres",
  "season": 2025,
  "league": "MLB",
  "verified": false,
  "source": {
    "provider": "Lahman Baseball Database (SABR)",
    "url": "https://sabr.org/lahman-database/",
    "retrieved_at": "2026-10-14",
    "note": "Lahman Baseball Database から機械的に生成（同じシーズンに複数の球団に在籍した選手は成績を合算し、PA は AB+BB+HBP+SF+SH で算出）。独立した第二出典との照合は未実施。使用した版：Release Date: Dec 10, 2025。"
  },
  "team_info": {
    "code": "SDN",
    "name": "San Diego Padres",
    "league": "NL"
  },
  "stats": {
    "PA": 343,
    "AB": 306,
    "H": 70,
    "2B": 11,
    "3B": 0,
    "HR": 3,
    "BB": 24,
    "HBP": 7,
    "SO": 56,
    "SF": 2,
    "SH": 4,
    "GIDP": 7,
    "SB": 5,
    "CS": 1
  }
}
