{
  "id": "hoernni01_2025",
  "name": "Nico Hoerner",
  "team": "Chicago Cubs",
  "season": 2025,
  "league": "MLB",
  "verified": false,
  "source": {
    "provider": "Lahman Baseball Database (SABR)",
    "url": "https://sabr.org/lahman-database/",
    "retrieved_at": "2026-10-14",
    "note": "Lahman Baseball Database から機械的に生成（同じシーズンに複数の球団に在籍した選手は成績を合算し、PA は AB+BB+HBP+SF+SH で算出）。独立した第二出典との照合は未実施。使用した版：Release Date: Dec 10, 2025。"
  },
  "team_info": {
    "code": "CHN",
    "name": "Chicago Cubs",
    "league": "NL"
  },
  "stats": {
    "PA": 649,
    "AB": 599,
    "H": 178,
    "2B": 29,
    "3B": 4,
    "HR": 7,
    "BB": 39,
    "HBP": 7,
    "SO": 49,
    "SF": 4,
    "SH": 0,
    "GIDP": 4,
    "SB": 29,
    "CS": 6
  }
}
