{
  "id": "pagesan01_2025",
  "name": "Andy Pages",
  "team": "Los Angeles Dodgers",
  "season": 2025,
  "league": "MLB",
  "verified": false,
  "source": {
    "provider": "Lahman Baseball Database (SABR)",
    "url": "https://sabr.org/lahman-database/",
    "retrieved_at": "2026-10-14",
    "note": "Lahman Baseball Database から機械的に生成（同じシーズンに複数の球団に在籍した選手は成績を合算し、PA は AB+BB+HBP+SF+SH で算出）。独立した第二出典との照合は未実施。使用した版：Release Date: Dec 10, 2025。"
  },
  "team_info": {
    "code": "LAD",
    "name": "Los Angeles Dodgers",
    "league": "NL",
    "lahman_id": "LAN"
  },
  "stats": {
    "PA": 624,
    "AB": 581,
    "H": 158,
    "2B": 27,
    "3B": 1,
    "HR": 27,
    "BB": 29,
    "HBP": 8,
    "SO": 135,
    "SF": 6,
    "SH": 0,
    "GIDP": 9,
    "SB": 14,
    "CS": 7
  }
}
